{
  "event_id": "55555555-5555-4555-8555-555555555555",
  "event_type": "billing.payment.succeeded.v1",
  "schema_version": 1,
  "occurred_at": "2026-07-17T01:02:03Z",
  "producer": "billing-service",
  "correlation_id": "44444444-4444-4444-8444-444444444444",
  "causation_id": null,
  "aggregate_type": "payment",
  "aggregate_id": "11111111-1111-4111-8111-111111111111",
  "partition_key": "user:33333333-3333-4333-8333-333333333333",
  "data": {
    "payment_id": "11111111-1111-4111-8111-111111111111",
    "order_id": "22222222-2222-4222-8222-222222222222",
    "user_id": "33333333-3333-4333-8333-333333333333",
    "plan_id": "vpn-30d-v1",
    "amount_minor": 29900,
    "currency": "RUB",
    "paid_at": "2026-07-17T01:02:03Z"
  }
}
